{
  "$schema": "https://json-schema.org/draft/2020-12/schema",
  "$id": "https://cios.local/schemas/flora-runtime/v0.1/workspace-state-v0.1.schema.json",
  "title": "Workspace State V0.1",
  "identifier": "workspace-state-v0.1",
  "version": "0.1.0",
  "description": "Non-canonical user workspace context.",
  "type": "object",
  "required": [
    "workspace_state_id",
    "user_id",
    "tenant_context",
    "focus_object_id",
    "schema_version",
    "created_at",
    "updated_at"
  ],
  "properties": {
    "workspace_state_id": {
      "type": "string"
    },
    "user_id": {
      "type": "string"
    },
    "tenant_context": {
      "type": "string"
    },
    "focus_object_id": {
      "type": "string"
    },
    "active_perspective": {
      "type": [
        "string",
        "null"
      ]
    },
    "navigation_trail": {
      "type": "array",
      "items": {
        "$ref": "common-definitions.schema.json#/$defs/Ref"
      }
    },
    "watch_state": {
      "type": "object",
      "additionalProperties": true
    },
    "filters": {
      "type": "object",
      "additionalProperties": true
    },
    "comparison_state": {
      "type": [
        "object",
        "null"
      ],
      "additionalProperties": true
    },
    "created_at": {
      "type": "string",
      "format": "date-time"
    },
    "updated_at": {
      "type": "string",
      "format": "date-time"
    },
    "retention_class": {
      "type": "string"
    },
    "schema_version": {
      "const": "0.1.0"
    }
  },
  "additionalProperties": false,
  "examples": [
    {
      "workspace_state_id": "ws-synthetic-ukbanking-001",
      "user_id": "user-synthetic-001",
      "tenant_context": "tenant-synthetic-internal",
      "focus_object_id": "BK-ENT-001",
      "active_perspective": "overview",
      "navigation_trail": [
        {
          "id": "BK-IND-002",
          "type": "Industry Twin",
          "source_asset_id": "BK-IND-002"
        },
        {
          "id": "BK-ENT-001",
          "type": "Enterprise Twin",
          "source_asset_id": "BK-ENT-001"
        }
      ],
      "watch_state": {
        "watched": true,
        "reason": "synthetic fixture"
      },
      "filters": {
        "show_unknowns": true,
        "show_contradictions": true
      },
      "comparison_state": null,
      "created_at": "2026-07-19T00:00:00Z",
      "updated_at": "2026-07-19T00:00:00Z",
      "retention_class": "short_lived_user_workspace",
      "schema_version": "0.1.0"
    }
  ]
}
