{"workspace_state_id":"ws-synthetic-ukbanking-001","user_id":"user-synthetic-001","tenant_context":"tenant-synthetic-internal","focus_object_id":"BK-ENT-001","active_perspective":"overview","navigation_trail":[{"id":"BK-IND-002","type":"Industry Twin","source_asset_id":"BK-IND-002"},{"id":"BK-ENT-001","type":"Enterprise Twin","source_asset_id":"BK-ENT-001"}],"watch_state":{"watched":true,"reason":"synthetic fixture"},"filters":{"show_unknowns":true,"show_contradictions":true},"comparison_state":null,"created_at":"2026-07-19T00:00:00Z","updated_at":"2026-07-19T00:00:00Z","retention_class":"short_lived_user_workspace","schema_version":"0.1.0"}
